user_id,article_title,article_content,article_like,article_date,view
1,"Lorem ipsum dolor sit amet","Lorem ipsum dolor sit amet, consectetur adipiscing elit, sed do eiusmod tempor incididunt ut labore et dolore magna aliqua. Ut enim ad minim veniam, quis nostrud exercitation ullamco laboris nisi ut aliquip ex ea commodo consequat. Duis aute irure dolor in reprehenderit in voluptate velit esse cillum dolore eu fugiat nulla pariatur. Excepteur sint occaecat cupidatat non proident, sunt in culpa qui officia deserunt mollit anim id est laborum",2,"2014-12-18",1000
1,"腠 慛慖 枲柊氠 娞弳弰","腠 慛慖 枲柊氠 娞弳弰, 漊煻獌 棰椻楒 鑏鑆驈 蒛 蓩蔮, 彔抳抰 戫摴撦 烳牼翐 嫫嵾 鉾 忁曨曣 捘栒毤 娞弳弰 賗 魡鳱 簥翷 耏胠臿 椸楢楩 緷, 璻甔 殠 嬽巃攇 擙樲橚 焟硱筎 鳭 璸瓁穟 忣抏旲 棳棔欿 駔鳿, 嬃 韰頯 肵苂苃 莃荶衒 榓甂睮",5,"2013-12-18",2000
2,"Lorem ipsum dolor","Lorem ipsum dolor sit amet, consectetur adipiscing elit, sed do eiusmod tempor incididunt ut labore et dolore magna aliqua. Ut enim ad minim veniam, quis nostrud exercitation ullamco laboris nisi ut aliquip ex ea commodo consequat. Duis aute irure dolor in reprehenderit in voluptate velit esse cillum dolore eu fugiat nulla pariatur. Excepteur sint occaecat cupidatat non proident, sunt in culpa qui officia deserunt mollit anim id est laborum",3,"2014-8-18",100
2,"とぴゅ盤 䤦䋨榚リュい","とぴゅ盤 䤦䋨榚リュい つ楥饺䰩みゅ ぷ䥞きょ棃覥 䨩蝣, 駧みょ 馜禤㤣 禞穯ずづビャ 簥ゞヘ䦤饪, シュ簯を さ饜 ツど䨩蝣チ 堦まが獧ゐ な障 骦僯楌だる 覟や餣㛤㠯 功壃廦, ぎ祟もりょ绣 䨵れぱ楯め 矩ぴ儥鄤ヅ すふ䏤 ふ䏤 觃槞饵功壃 ぢゅ润セファ趣 䰩みゅ 馜禤㤣, 禞穯ず 廩す 䤦䋨榚リュい 馜禤㤣杧ぐ 襟のよ覌矤 饟ピ期 な障 椧にゅグァごシュ 壪ちょ馨盨㛥 矩ぴ儥鄤ヅ, 楣饥しょ查に 	てあ焨䨣ぎゃ とぴゅ盤む鍯 ちゃにゃしゃ 禧氧, 蟤秵 趣矩ぴ 簯をおびょく つ楥饺䰩みゅ や餣 穟っ䶥 骦僯楌だる 窨極億䦌諥 韩獤ひ埩苦 䦌諥 饺䰩みゅ 誧ヴョ䦞襨µ 堦まが獧ゐ, のよ 廦饟ピ期ぎょ 	てあ焨䨣ぎゃ 駧みょ嶥りゅ裌 びゅんゆ",51,"2014-10-18",634
2,"Анкилльаы партйэндо витюпэраторебуз","Анкилльаы партйэндо витюпэраторебуз зыд ут. Факильизиж рэформйданч ты шэа, ад алёэнюм кончэктэтюыр мэль, эож ед вэре видишчы ратионебюж. Факэр нобёз ыам ут, нам вёжи коммодо йн. Ныморэ волумюч пэрчыквюэрёж нам ут. Лорэм дежпютатионй пэр экз, вяш нэ црял мэдиокретатым, хаж йн новум плььатонэм жямиляквюы.Юллюм дйкит либриз ыт квюо, ан эрюдитя янжольэнж жямиляквюы дуо. Тальэ дйкит мыа экз, ты выро конжюль лэгыры квуй. Еюж ыт толлйт зальутанде пхйложопхяа, ку эрож дёжжэнтиюнт хёз. Фэугяат пэржыкюти мыа нэ, чент кевёбюж факёльиси пэр эа.",14,"2015-01-10",1520
1, "Những trải nghiệm nên thử tại Hội An - đạp xe dọc phố cổ","Với giá thuê xe chỉ tầm 20k-50k/chiếc/ngày, và diện tích của Hội An cũng không quá lơn, cộng thêm việc BQL phố cổ cấm xe máy chạy trong phố vào giờ cao điểm vào chiều và tối thì xe đạp là phương tiện được hầu hết du khách nước ngoài và một phần du khách Việt ưa thích. Mình để ý thấy là hình như các bạn Việt không thích đạp xe cho lắm vì \"mệt, nắng và nóng\". Điều này đúng, nếu bạn có kế hoạch đi chơi xa thì thuê xe máy là một lựa chọn thích hợp, nhưng nếu bạn muốn đi dạo phố cổ thì tốt nhất là nên lựa chọn xe đạp là phương tiện chính. Đạp xe thong dong trong Hội An để cảm nhận được cái chậm rãi của cuộc sống nơi phố cổ, chưa kể bạn sẽ tiết kiệm thời gian hơn so với việc đi bộ nữa",4,"2015-09-01",1615
2, "Những trải nghiệm nên thử tại Hội An - đi thuyền trên sông Hoài","Sông Hoài là con sông vắt ngang phố cổ. Vào ban đêm, khi Hội An lung linh với ánh sáng đèn lồng, thì việc vừa chèo thuyền vừa thư thả ngắm nhìn đô thị cổ đẹp nhất Việt Nam này từ phía dưới sông là một trải nghiệm sẽ để lại dấu ấn khó phai. Giá thuê thuyền ở đây là 50k cho 30p tham quan, bạn có thể mặc cả lên 45p, vào ban ngày, nếu như trời mát và khách vắng thì cuộc dạo chơi có thể đi xa hơn và lâu hơn nữa. Các cô chủ thuyền rất thân thiện, mình đã thử nhờ cô dạy cách chèo thuyền và có thể tự chèo được một quãng sông Hoài rồi đấy nhé. Để trải nghiệm trọn vẹn nhất chuyến dạo chơi vào ban đêm thì bạn có thể mua thêm vài bông hoa đăng bằng giấy để vừa thả vừa ngắm nhìn Hội An lung linh trong đêm",9,"2015-08-29",725
3,"Những trải nghiệm nên thử tại Hội An - cafe sáng cùng bánh mì","Mình đã có một buổi sáng khó quên với bánh mì bà Khanh (Trần Cao Vân) nổi tiếng và ly cafe trong quán cóc ngay phía trước Chùa Cầu và mình nghĩ là các bạn cũng không nên bỏ qua trải nghiệm này. Với ổ bánh mì giòn tan nổi tiếng với đầy đủ gia vị thơm phức cùng nhiều loại nhân bánh khác nhau trên tay, kèm theo gió từ bờ sông thổi nhè nhẹ, thì mình tin là các bạn có thể ngồi cả ngày để ngắm nhìn phố cổ. Mình nghĩ là không còn gì đơn giản hơn để định nghĩa sự yên bình đâu nhỉ",6,"2015-09-02",3624
1, "Những trải nghiệm nên thử tại Hội An - bbq tại biển An Bàng","Biển An Bàng là bãi biển mới của Hội An, vì lý do Cửa Đại bị sạt lở từ nhiều năm trước và đang trong quá trình tu sửa nên An Bàng nghiễm nhiên trở thành nơi thu hút khách của Hội An. Chuẩn bị BBQ tại biển An Bàng cũng rất dễ, mình đã tự mua lò than cùng các vật dụng khác, rồi mua thêm vài món hải sản bán ở chợ Hội An là đã có thể làm một bữa tiệc BBQ thơ mộng ngay tại biển. Thời gian thích hợp nhất để BBQ có lẽ là buổi sáng, bạn nên ra biển sớm để nhóm bếp, vừa ăn vừa sưởi ấm vừa chờ đón bình minh. Mình cam đoan là bạn sẽ không tài nào quên được trải nghiệm này và biết đâu bạn sẽ bị nghiện hình thức BBQ đầy thú vị này thì sao. Dù gì đi chăng nữa thì trải nghiệm cũng chỉ có ý nghĩa khi tự mình thực hiện và khám phá. Vậy nên mình hy vọng các bạn có thể tự tìm ra một số những trải nghiệm khác mới lạ hơn nữa và chia sẻ cho Ulibi biết nhé",9,"2015-09-03",4632